[
  {
    "term": "Amendment",
    "definition": "A change to the Constitution. There have been 27, and each needed the approval of three-fourths of the states.",
    "language": "en",
    "topic": "American Government",
    "source": {
      "url": "https://www.uscis.gov/sites/default/files/document/brochures/USCIS-2025-Civics-Test-Study-Guide.pdf",
      "section_or_page": "Chapter 1, page 15"
    }
  },
  {
    "term": "Preamble",
    "definition": "The beginning of the Constitution. It explains why the Founders wrote it and says the people will govern themselves.",
    "language": "en",
    "topic": "American Government",
    "source": {
      "url": "https://www.uscis.gov/sites/default/files/document/brochures/USCIS-2025-Civics-Test-Study-Guide.pdf",
      "section_or_page": "Chapter 1, page 9"
    }
  },
  {
    "term": "Founders",
    "definition": "The leaders who met at the Constitutional Convention in 1787 and wrote the Constitution, such as George Washington, Benjamin Franklin, James Madison and Alexander Hamilton.",
    "language": "en",
    "topic": "American Government",
    "source": {
      "url": "https://www.uscis.gov/sites/default/files/document/brochures/USCIS-2025-Civics-Test-Study-Guide.pdf",
      "section_or_page": "Chapter 1, page 8"
    }
  },
  {
    "term": "Constitutional Convention",
    "definition": "The meeting in Philadelphia, Pennsylvania, in 1787 at which the Constitution was written.",
    "language": "en",
    "topic": "American Government",
    "source": {
      "url": "https://www.uscis.gov/sites/default/files/document/brochures/USCIS-2025-Civics-Test-Study-Guide.pdf",
      "section_or_page": "Chapter 1, page 8"
    }
  },
  {
    "term": "Self-government",
    "definition": "The people govern themselves by electing representatives, and are not ruled by a king or queen.",
    "language": "en",
    "topic": "American Government",
    "source": {
      "url": "https://www.uscis.gov/sites/default/files/document/brochures/USCIS-2025-Civics-Test-Study-Guide.pdf",
      "section_or_page": "Chapter 1, page 9"
    }
  },
  {
    "term": "Federal government",
    "definition": "Another name for the U.S. government, as opposed to the government of a state.",
    "language": "en",
    "topic": "American Government",
    "source": {
      "url": "https://www.uscis.gov/sites/default/files/document/brochures/USCIS-2025-Civics-Test-Study-Guide.pdf",
      "section_or_page": "Chapter 1, page 10"
    }
  },
  {
    "term": "Separation of powers",
    "definition": "Giving each branch of government different powers, so that no one branch can become too powerful.",
    "language": "en",
    "topic": "American Government",
    "source": {
      "url": "https://www.uscis.gov/sites/default/files/document/brochures/USCIS-2025-Civics-Test-Study-Guide.pdf",
      "section_or_page": "Chapter 1, page 12"
    }
  },
  {
    "term": "Rule of law",
    "definition": "The principle that no one is above the law and everyone, including the government, must follow it.",
    "language": "en",
    "topic": "American Government",
    "source": {
      "url": "https://www.uscis.gov/sites/default/files/document/brochures/USCIS-2025-Civics-Test-Study-Guide.pdf",
      "section_or_page": "Chapter 1, page 15"
    }
  },
  {
    "term": "Treaty",
    "definition": "An agreement between two or more countries, for example to end a war or to work together on trade.",
    "language": "en",
    "topic": "American Government",
    "source": {
      "url": "https://www.uscis.gov/sites/default/files/document/brochures/USCIS-2025-Civics-Test-Study-Guide.pdf",
      "section_or_page": "Chapter 1, page 13"
    }
  },
  {
    "term": "Governor",
    "definition": "The person in charge of the executive branch of a state government.",
    "language": "en",
    "topic": "American Government",
    "source": {
      "url": "https://www.uscis.gov/sites/default/files/document/brochures/USCIS-2025-Civics-Test-Study-Guide.pdf",
      "section_or_page": "Chapter 1, page 14"
    }
  },
  {
    "term": "Bill of Rights",
    "definition": "The first ten amendments to the Constitution, which list some of the basic rights of people living in the United States.",
    "language": "en",
    "topic": "American Government",
    "source": {
      "url": "https://www.uscis.gov/sites/default/files/document/brochures/USCIS-2025-Civics-Test-Study-Guide.pdf",
      "section_or_page": "Chapter 1, page 16"
    }
  },
  {
    "term": "Congress",
    "definition": "The legislative branch of the U.S. government, which makes federal laws. It has two parts, the House of Representatives and the Senate.",
    "language": "en",
    "topic": "American Government",
    "source": {
      "url": "https://www.uscis.gov/sites/default/files/document/brochures/USCIS-2025-Civics-Test-Study-Guide.pdf",
      "section_or_page": "Chapter 2, page 18"
    }
  },
  {
    "term": "Bill",
    "definition": "A proposal for a new law, written by members of Congress.",
    "language": "en",
    "topic": "American Government",
    "source": {
      "url": "https://www.uscis.gov/sites/default/files/document/brochures/USCIS-2025-Civics-Test-Study-Guide.pdf",
      "section_or_page": "Chapter 2, page 22"
    }
  },
  {
    "term": "Veto",
    "definition": "The President not signing a bill. The bill then does not become law unless Congress votes to override the veto.",
    "language": "en",
    "topic": "American Government",
    "source": {
      "url": "https://www.uscis.gov/sites/default/files/document/brochures/USCIS-2025-Civics-Test-Study-Guide.pdf",
      "section_or_page": "Chapter 2, page 22"
    }
  },
  {
    "term": "Federal law",
    "definition": "A rule that everyone in the United States must follow.",
    "language": "en",
    "topic": "American Government",
    "source": {
      "url": "https://www.uscis.gov/sites/default/files/document/brochures/USCIS-2025-Civics-Test-Study-Guide.pdf",
      "section_or_page": "Chapter 2, page 22"
    }
  },
  {
    "term": "Majority",
    "definition": "More than half. A bill needs a majority in both parts of Congress, and a Supreme Court decision needs a majority of the justices.",
    "language": "en",
    "topic": "American Government",
    "source": {
      "url": "https://www.uscis.gov/sites/default/files/document/brochures/USCIS-2025-Civics-Test-Study-Guide.pdf",
      "section_or_page": "Chapter 2, page 22"
    }
  },
  {
    "term": "Cabinet",
    "definition": "A group of advisors. The President's Cabinet advises the President and is made up of the leaders of the executive departments and others the President chooses.",
    "language": "en",
    "topic": "American Government",
    "source": {
      "url": "https://www.uscis.gov/sites/default/files/document/brochures/USCIS-2025-Civics-Test-Study-Guide.pdf",
      "section_or_page": "Chapter 3, page 25"
    }
  },
  {
    "term": "Commander in Chief",
    "definition": "The President's role as the person in charge of everyone serving in the U.S. military.",
    "language": "en",
    "topic": "American Government",
    "source": {
      "url": "https://www.uscis.gov/sites/default/files/document/brochures/USCIS-2025-Civics-Test-Study-Guide.pdf",
      "section_or_page": "Chapter 3, page 26"
    }
  },
  {
    "term": "Justice",
    "definition": "Another word for a judge, used for the nine members of the Supreme Court.",
    "language": "en",
    "topic": "American Government",
    "source": {
      "url": "https://www.uscis.gov/sites/default/files/document/brochures/USCIS-2025-Civics-Test-Study-Guide.pdf",
      "section_or_page": "Chapter 4, page 31"
    }
  },
  {
    "term": "Federalist Papers",
    "definition": "Eighty-five essays by James Madison, Alexander Hamilton and John Jay, printed in newspapers in 1787 and 1788, that supported passing the Constitution.",
    "language": "en",
    "topic": "American History",
    "source": {
      "url": "https://www.uscis.gov/sites/default/files/document/brochures/USCIS-2025-Civics-Test-Study-Guide.pdf",
      "section_or_page": "Chapter 5, page 33"
    }
  },
  {
    "term": "Selective Service",
    "definition": "The system that men who are U.S. citizens or legal residents must register with between the ages of 18 and 26.",
    "language": "en",
    "topic": "American Government",
    "source": {
      "url": "https://www.uscis.gov/sites/default/files/document/brochures/USCIS-2025-Civics-Test-Study-Guide.pdf",
      "section_or_page": "Chapter 5, page 35"
    }
  },
  {
    "term": "Oath of Allegiance",
    "definition": "The promises of loyalty to the United States that applicants make at a naturalization ceremony. They become citizens when they take it.",
    "language": "en",
    "topic": "American Government",
    "source": {
      "url": "https://www.uscis.gov/sites/default/files/document/brochures/USCIS-2025-Civics-Test-Study-Guide.pdf",
      "section_or_page": "Chapter 5, page 36"
    }
  },
  {
    "term": "Naturalization",
    "definition": "One of the ways a person can become a U.S. citizen: by applying, passing the test and interview, and taking the Oath of Allegiance.",
    "language": "en",
    "topic": "American Government",
    "source": {
      "url": "https://www.uscis.gov/sites/default/files/document/brochures/USCIS-2025-Civics-Test-Study-Guide.pdf",
      "section_or_page": "Chapter 5, page 36"
    }
  },
  {
    "term": "Territory",
    "definition": "An area that is part of the United States but is not a state. The United States has five.",
    "language": "en",
    "topic": "American Government",
    "source": {
      "url": "https://www.uscis.gov/sites/default/files/document/brochures/USCIS-2025-Civics-Test-Study-Guide.pdf",
      "section_or_page": "Chapter 6, page 38"
    }
  },
  {
    "term": "Native Americans",
    "definition": "The people who lived in North and South America before Europeans arrived. They are also called American Indians.",
    "language": "en",
    "topic": "American History",